{
  "schema": "mathlab.rcp.claim.v1",
  "id": "HYP105-AA4N-QUENCHED-LOWER",
  "program": "HYP-105",
  "root_issue": 230,
  "title": "For every right map, conditional expectation Omega(s^6)",
  "statement": "For s=2^h>=8, every complete globally injected right-line map g satisfies E_f[I_L^(BA,int)(f,g)|g]>=3*s^6/65536 for one uniformly drawn complete globally injected left-point map f. Therefore min_g max_f I_L^(BA,int)(f,g)>=3*s^6/65536, NOT min_(f,g).",
  "mode": "CONDITIONAL_EXPECTATION",
  "mathematical_status": "DOCUMENTED_IN_DRAFT",
  "review_status": "NOT_REVIEWED",
  "novelty_status": "NOT_ASSESSED",
  "root_impact": "ROOT_BRANCHES_OPEN",
  "quantifiers": [
    {
      "op": "forall",
      "variable": "h",
      "domain": "integer h>=3, s=2^h"
    },
    {
      "op": "forall",
      "variable": "g",
      "domain": "arbitrary fixed complete globally injected original line map"
    },
    {
      "op": "expectation",
      "variable": "f",
      "domain": "one uniformly sampled complete globally injected original point map, with fixed g"
    }
  ],
  "model_ids": [
    "MODEL-GQ-ORIGINAL",
    "MODEL-TYPED-GLOBAL-INJECTION",
    "MODEL-ORIGINAL-SIXSET",
    "MODEL-POSITIVE-GF5-SEVEN",
    "MODEL-UNIFORM-GLOBAL-ENSEMBLE",
    "MODEL-BA-INTERNAL-CHARGE"
  ],
  "depends_on_claims": [
    "HYP105-AA4N-QUENCHED-IDENTITY"
  ],
  "external_dependencies": [
    "AA4-I genuine original source-line spectral disjoint-pair lower and AA4-N occupied K_a cycle completion proof."
  ],
  "limitations": [
    "Does not yield min_(f,g) I_L^(BA,int)(f,g)>0.",
    "Does not imply universal seven-class S_s(f,g)>=c*s^6.",
    "No Branch A proof nor full risk exponent."
  ],
  "falsification_boundary": "High average f for every g permits exceptional f with low charge; g cannot be changed separately for each original Q.",
  "source": {
    "repository": "definitely-stable/Mathlab",
    "pr": 470,
    "commit": "2af74df348a9c0921497757356199a609252f2c2",
    "proof_path": "docs/research/HYP-105-ISSUE230-D6AA4N-QUENCHED-RIGHT-TRANSFER.md",
    "proof_blob_sha": "6435ed6e9c84134eb9adaf5edfe78f7b6c652bd4",
    "stage": "OPEN_DRAFT_PR"
  }
}
