{
  "schema": "mathlab.rcp.claim.v1",
  "program": "HYP-105",
  "root_issue": 230,
  "mathematical_status": "DOCUMENTED_IN_DRAFT",
  "review_status": "NOT_REVIEWED",
  "novelty_status": "NOT_ASSESSED",
  "root_impact": "ROOT_BRANCHES_OPEN",
  "source": {
    "repository": "definitely-stable/Mathlab",
    "pr": 486,
    "commit": "f49dcef044e8a4f1bb17f080ffa11c7b365a077a",
    "proof_path": "docs/research/HYP-105-ISSUE230-D6AA4U-SOURCE-FOREST-TRANSPORTATION.md",
    "proof_blob_sha": "364f95d0dfd94d693d0152abf571a1312532ba14",
    "stage": "OPEN_DRAFT_PR"
  },
  "id": "HYP105-AA4U-W32-ZERO-MARGINAL-POSITIVE-JOINT",
  "title": "Finite genuine W32 nine-cell positive actual joins with zero relaxed non-AA certificates",
  "mode": "LOCAL_CONSTRUCTION",
  "statement": "For h=1 genuine W(3,2), specific source point/line complete globally injected K6 maps S68 and S72 exhibit zero in EACH eight NON-AA source-forest Fréchet marginal-only lower floor and hence zero summed relaxed non-AA bound, but ACTUAL original six-incidence-ID non-AA joint accepted positive GF5 counts are 68 and 72. The nine physically jointly admissible source-cell counts S68 are A/A=263, A/B=21, B/A=44, B/B-overlap=2, B/B-disjoint=1 and zeros otherwise; S72 A/A=286,A/B=31,B/A=36,B/B-overlap=1,B/B-disjoint=2,C/A=2 and zeros otherwise. All A/A joint sets in these particular two global fixtures have zero aligned D6, so the true total seven-class accepted counts are respectively 68 and 72, not their raw joined sums 331 and 358. This finite method certificate is not an all-h adversarial counterfamily.",
  "quantifiers": [
    {
      "op": "forall",
      "variable": "h",
      "domain": "integer h=1, s=2^h=2; finite genuine original W(3,2) ONLY, not all h"
    },
    {
      "op": "exists",
      "variable": "f,g",
      "domain": "the actual finite globally injected genuine W(3,2) source K6 assignments S68 and S72"
    },
    {
      "op": "finite_witness",
      "variable": "Q",
      "domain": "original 45-flag W32 sixset source forest stratification and the same-incidence-ID physical dual joined seven-GF5 census"
    }
  ],
  "model_ids": [
    "MODEL-GQ-ORIGINAL",
    "MODEL-TYPED-GLOBAL-INJECTION",
    "MODEL-ORIGINAL-SIXSET",
    "MODEL-POSITIVE-GF5-SEVEN",
    "MODEL-SELECTED-LOCAL-PATTERN"
  ],
  "depends_on_claims": [
    "HYP105-AA4U-FOREST-FRECHET-LOWER",
    "HYP105-AA4U-W32-NINE-FOREST-CENSUS"
  ],
  "external_dependencies": [
    "Pinned W32 S68 and S72 source fixtures and historical original seven-positive-GF5 classifier.",
    "Original source AA4-Q same-six-ID exact joined physical intersection and AA4-T connected aligned D6 tensor definitions."
  ],
  "limitations": [
    "A zero relaxed source-cell floor does NOT mean the true non-AA intersection can be zero for some globally coherent f,g.",
    "Finite S68/S72 have genuine POSITIVE S_s=68/72, so they do not disprove universal all-h S=Omega(s^6).",
    "The 263/286 A/A joined sets are NOT accepted D6 in these fixtures; actual D6 is zero."
  ],
  "falsification_boundary": "Keep 45 true original W32 incidence IDs, complete globally injected f,g, all nine original source forest cells and independently check the seven-class accepted original joint."
}
