{
  "schema": "mathlab.rcp.claim.v1",
  "program": "HYP-105",
  "root_issue": 230,
  "mathematical_status": "DOCUMENTED_IN_DRAFT",
  "review_status": "NOT_REVIEWED",
  "novelty_status": "NOT_ASSESSED",
  "root_impact": "ROOT_BRANCHES_OPEN",
  "source": {
    "repository": "definitely-stable/Mathlab",
    "pr": 484,
    "commit": "c51448b4e47b17737285ef8e6b7ea09991a8c289",
    "proof_path": "docs/research/HYP-105-ISSUE230-D6AA4T-QUENCHED-ALIGNED-D6.md",
    "proof_blob_sha": "7d19b0f32e6fa8d7d57f324c826c0b84d1ce9780",
    "stage": "OPEN_DRAFT_PR"
  },
  "id": "HYP105-AA4T-ALLH-DUAL-QUENCHED-LOWER",
  "title": "Genuine GQ point-line dual every-fixed-line all-h D6 expected floor",
  "mode": "CONDITIONAL_EXPECTATION",
  "model_ids": [
    "MODEL-GQ-ORIGINAL",
    "MODEL-TYPED-GLOBAL-INJECTION",
    "MODEL-ORIGINAL-SIXSET",
    "MODEL-POSITIVE-GF5-SEVEN",
    "MODEL-UNIFORM-GLOBAL-ENSEMBLE"
  ],
  "quantifiers": [
    {
      "op": "forall",
      "variable": "h",
      "domain": "integer h>=1, s=2^h, genuine original W(3,s)"
    },
    {
      "op": "forall",
      "variable": "g",
      "domain": "any fixed complete ORIGINAL line-source globally injective physical unordered pair-label assignment"
    },
    {
      "op": "expectation",
      "variable": "f",
      "domain": "one independently uniformly sampled COMPLETE globally injected original point map shared over all original source Q"
    }
  ],
  "statement": "By genuine W(3,2^h) point/line incidence duality, for every h>=1 and every fixed complete global ORIGINAL line assignment g, E_f[D6(f,g)|g]>=s^6/98304 for uniformly random ONE full globally injected point map f. This separately reverses fixed and averaged source types; it neither averages both sides nor establishes inf_(f,g) D6 or S_s.",
  "depends_on_claims": [
    "HYP105-AA4T-ALLH-QUENCHED-D6-LOWER"
  ],
  "external_dependencies": [
    "Genuine GQ W(3,2^h) point-line source self-duality, with original incidence-ID and physical C6 positional matching preserved."
  ],
  "limitations": [
    "At h>=3 AA4RCYC stronger dual 1/8 bound remains available.",
    "No all-f,g adversarial positive lower is implied.",
    "Cannot transfer uncritically to non-self-dual source incidence systems."
  ],
  "falsification_boundary": "The original GQ duality must preserve the exact same-six-column D6 acceptance criterion and type-separated global injections."
}
